url,domain,title,authors,publish_date,summary,text
,reddit.com/r/trees,"First of all, as a girl, it would be next to impossible for you to find weed. Hash would be more likely but even then, extremely rare. In Saudi Arabia it's so illegal you could get your head cut off for the right amount. Especially if you area foreigner they might suspect you of smuggling.",[deleted],00-11-2011,,"Thanks for the love! Same to you! I'm not totally sure what the laws are like in Beirut, but I willtell you what it would be like if you were coming to Saudi. First of all, as a girl, it would be next to impossible for you to find weed. Hash would be more likely but even then, extremely rare. In Saudi Arabia it's so illegal you could get your head cut off for the right amount. Especially if you area foreigner they might suspect you of smuggling. Keep in mind that here, most women are supposed to see their lives as a priviledge afforded to them by men, (which in a lot of situations, is financially the case) You might get lucky here and there, but most likely from some dude who wants to get into your pants. Chances are you are better of just giving it a rest for a while- I had to and it went better than expected. I dont fiend or suffer from cravings since I know it's just impossible to get at the moment. Just pick up a hobby, (I started making electro music :  ) and that keeps me comfortably busy. Take it as an opportunity to quit smoking and healthy up your lungs a bit. I didn't notice a huge difference in my quality of life, but I no longer feel out of breath which is definitely a plus in such a hot country! Most of all, don't freak out, you'll enjoy yourself no matter what the situation is. Peace and Love! -J"
,reddit.com/r/todayilearned,"As for the cost prohibitive parts, from your ""watching"" people sell pot you probably a lot of that money went back into buying inventory, then buying other things that you derive more enjoyment from than a gun. But glad i could help you see the other side of the fence, just realize in all things when a politician says ""think of the children"" to take a long hard look at the facts of the argument because he likely has none and is just trying to play on emotions.",pj1843,00-9-2012,,"The thing most people are unwilling to accept(especially politicians) is that gun violence isn't due to guns, it is due to the same thing that causes violence and that is socio-economics. As long as we continue the war on drugs, ignore urban populations, and give the big fuck you to poor minorities that don't vote we will always have violent crime. If we wanted to fix the crime problem we would provide these people in urban centers with more ways out and opportunities. It is just to easy to go after the evil guns and try and treat symptoms instead of going after the problems. As for the cost prohibitive parts, from your ""watching"" people sell pot you probably a lot of that money went back into buying inventory, then buying other things that you derive more enjoyment from than a gun. But glad i could help you see the other side of the fence, just realize in all things when a politician says ""think of the children"" to take a long hard look at the facts of the argument because he likely has none and is just trying to play on emotions. Also vote the fucker out of office because it's a shitty manipulative tactic."
,reddit.com/r/trees,"What seems to be a common trend here is that someone will post something along the lines of ""Weed is way better than drinking and cigarettes,"" or ""I smoke only weed cause alcohol and cigarettes suck."" And then a post comes along that's about how stoners shouldn't be judgmental and that it's hypocritical to say those kinds of things against those who drink and smoke cigs.",[deleted],00-5-2012,,"What seems to be a common trend here is that someone will post something along the lines of ""Weed is way better than drinking and cigarettes,"" or ""I smoke only weed cause alcohol and cigarettes suck."" And then a post comes along that's about how stoners shouldn't be judgmental and that it's hypocritical to say those kinds of things against those who drink and smoke cigs. So because most problems stem from a lack of understanding, let's try to put this into perspective. For example, I drink but not nearly as often as I smoke weed and I much prefer to smoke weed than I do to drink. I don't smoke cigs because it's so bad for you, but I have friends that do and I have no problem with them when they do. I also have no problem with my straight edge friends and friends who don't smoke weed. This criticism of alcohol and cigs are not necessarily out of disrespect or hate for those things, but because there is a frustration felt by a lot of stoners that justice isn't being done. Even if you disregard all of the positive benefits of smoking weed mentally and physically, even if weed was as bad for you as alcohol or cigarettes, then there still should be no reason why it is illegal when other drugs like alcohol and tobacco are legal. There's a frustration that much more harmful substances like alcohol and tobacco are completely legal but due to corruption, misinformation/lies, xenophobia, corporate lobbying and their huge sacks of money, and authoritarian organizations like Above the Influence a great and relatively harmless substance like marijuana is illegal, that's not right, and it makes a lot of us frustrated and angry. So if you smoke cigs and you drink, next time there's a post about how much better weed is than those things (which I agree with) all of the upvotes are not saying that people that only smoke weed are better than you. I'm sure there are those who think that because they only smoke weed they are better than others, but most of the people are just taking out a very small part of their frustration by upvoting something that shows the unfair nature of marijuana prohibition. And if you are still offended after all of this, put away the alcohol, cigs, and chill the fuck out and smoke a blunt with me."
,reddit.com/r/politics,"For a school project I took their page on Marijuana and looked at every word on the page (read the citations too) and found 6 full pages of error and outdated/disproven theories published. If the education on the subjects was up to date and correct, there would be very little opposition to the legalization of Cannabis (perhaps other drugs too).",[deleted],00-6-2012,,"I agree, although the low approval ratings and ""taboo""-ness of the subject are fueled not by people's hatred of the drug, but their half formulated opinions based on the shoddy science being produced. When entities such as Above The Influence are active in their campaigns they readily miseducate young children about drug use. For a school project I took their page on Marijuana and looked at every word on the page (read the citations too) and found 6 full pages of error and outdated/disproven theories published. If the education on the subjects was up to date and correct, there would be very little opposition to the legalization of Cannabis (perhaps other drugs too). An example I am going to use is the British Lung Foundation's recent publication where they claim that Marijuana usage causes cancer to be 20(?) times more likely in the user's lungs. The study references various sources but fails to cite many updated or currently accepted studies. In addition to this, two major studies done with appropriate sample sizes came to an adverse conclusion. Even worse, the BLF cannot confirm a single case where marijuana caused lung cancer, but they can produce plenty where Tobacco did (their counter-variable). Not to mention they fail to provide any evidence for their claim. After long pages of data and scientific rambling a conclusion is poorly jumped to. Studies like that are what cause the anti-drug sentiment in the US, England, and the United Nations (SOCHUM)."
,reddit.com/r/changemyview,"If you want us to change your view, ""I despise pro-Marijuana advocates. "", I can't help you. You're 100% justified in despising the individual who told you that smoking would have cured your Dad. I also don't doubt that you've met other vocal idiots. ~~Whether these individuals represent the movement as a whole is your subjective judgement.~~ I don't believe these individuals are representative of people who support legalization in general, but I know they exist because I've met them too.",horsedickery,00-12-2013,,"What view do you want to change? If you want us to change your view, ""I despise pro-Marijuana advocates."", I can't help you. You're 100% justified in despising the individual who told you that smoking would have cured your Dad. I also don't doubt that you've met other vocal idiots. ~~Whether these individuals represent the movement as a whole is your subjective judgement.~~ I don't believe these individuals are representative of people who support legalization in general, but I know they exist because I've met them too. Whether you like or despise the movement as a whole is your subjective opinion and I can't help you with that.>I don't want evidence that the drug itself is good, but I am looking for some reason why I should vote to let such people get what they want. I would invite you to learn about cannabis itself: it's potential for addiction or lack thereof, it's application to medicine (very limited but real), and the social and economic effects of legalization as opposed to prohibition. This, rather than the character of the activists, will inform how you vote. *I think that by going down this road you will also find more rational people advocating legalization too.*Editted for clarity."
,reddit.com/r/changemyview,"Steve Jobs dropped acid, Obama smoked weed, every musician has done pretty much everything, buisnessmen and hollywood people do coke, drugs don't just make people into losers and it is a ignorant stereotype to think that they do not help a lot of people. The horrible fuck ups are covered, the people doing it responsibly aren't talked about.",tangowhiskeyyy,00-4-2013,,"Ok, they just have a different view of drugs. Maybe they are wrong. Humans have been consuming psychedelics forever, other cultures praised them. I think you just need to educate yourself on the fact that drugs do not just make their users losers. Drugs power art and music. Drugs have helped tons of cultures. Shamans have been eating mushrooms and not ruining societies for thousands of years. Drugs have good potential, you just have learned otherwise from a campaign that has motives that are NOT protection people. Steve Jobs dropped acid, Obama smoked weed, every musician has done pretty much everything, buisnessmen and hollywood people do coke, drugs don't just make people into losers and it is a ignorant stereotype to think that they do not help a lot of people. The horrible fuck ups are covered, the people doing it responsibly aren't talked about. I would go ahead and argue drugs do wonders for society. Psychedelics are an excellent mind expanding tool. Alcohol has probably been present at every important affair since the dawn of time. Ketamine has been shown to treat depression. MDMA has excellent therapeutic value for things like PTSD. Drugs are wonderful for some peoples mental health, and if it is not it is not because of the drug but the reason for using it. What is making it bad is the ignorance that is perpetuated by their illegality. People are doing stupid doses, people are doing drugs in a way that harm themselves because they do not know how to do it right because of the illegality. Explain to me why, exactly, drugs are so bad. Cocaine and weed used to be legal, opiates used to be in kids cough medicine, and the world didn't fall apart into unproductive nonsense."
,reddit.com/r/changemyview,"If you wanted to argue ""I think legalization of pot is bad, CMV"", you could have done that, and it would be a completely different debate. Instead, you went with a title that basically insinuates that legalization advocates are either addicts or dealers. I think that specific argument has been disproven, and you've acknowledged as much (even here, 'substance abuse' is very different from 'addiction'; most college kids abuse alcohol at some point, but only a small percent are alcoholics).",[deleted],00-8-2013,,"Most of these are totally different points, though. If you wanted to argue ""I think legalization of pot is bad, CMV"", you could have done that, and it would be a completely different debate. Instead, you went with a title that basically insinuates that legalization advocates are either addicts or dealers. I think that specific argument has been disproven, and you've acknowledged as much (even here, 'substance abuse' is very different from 'addiction'; most college kids abuse alcohol at some point, but only a small percent are alcoholics). The benefits vs costs of marijuana, pot subculture, health effects, etc. have nothing to do with the stated topic of this CMV, which is a presumption about the nature of advocates. The one thing you do say that is relevant (""most people who smoke are involved in a lifestyle that revolves around it"") requires some pretty strong statistical support to back up and actually flies in the face of stated evidence (the number of people who support legalization is dramatically higher than the number of people who are regularly involved in the stoner lifestyle.)I'm not trying to convince you that you should support legalization, because that's not what this CMV is about (and that is a much, much more difficult point to argue). I'm trying to convince you that by assuming legalization advocates are either addicts or dealers, you're making a huge and measurably false presumption. Nothing more, nothing less."
,reddit.com/r/changemyview,"ancient Egyptian tombs had cannabis in them. several other ancient cultures have used a wide range of intoxicants, not just alcohol. as for your argument about crime rates during the prohibition era - prohibition is what allowed organized crime to gain a foothold in modern society.",T-Breezy16,00-1-2014,,"you mention that alcohol is as old as human civilization... ancient Mayans used mushrooms, ayahuasca, and salvia. ancient Egyptian tombs had cannabis in them. several other ancient cultures have used a wide range of intoxicants, not just alcohol. as for your argument about crime rates during the prohibition era - prohibition is what allowed organized crime to gain a foothold in modern society. there were more illegal drinking establishments and speak-easies in NYC at that time than there are liquor stores today. there will always be supply if there is a demand. it was true then, the same is true now. if pot were legal, though, the government and society writ-large would be benefiting instead of criminals flying below the radar. finally, yes there have been major crack downs on drunk driving, but it is certainly NOT vilified in modern movies or television. The Hangover series certainly proves that. if you want to use an example that works, take cigarettes. modern smoking rates are way down from several decades ago. This is because of public health awareness campaigns as well as limiting tobacco advertisements, and disallowing tobacco use in public spaces. If cannabis was made legal, and was done so with a similar public health awareness campaign, rather than the misinformation we have now, where would the problem be?"
,reddit.com/r/changemyview,"*Example: Let's say a guy gets arrested for having a lot of weed. It's illegal to possess marijuana, and you're a judge. You disagree with the law, but because you are a judge, you have to ""remain objective"" and sentence the guy based on the evidence that he has a giant bag of weed.",AntiEssentialism,00-3-2014,,"But you aren't being objective here. You are still making a subjective judgment based on notions defined by your cultural experience. Calling people ""suppressed"" or ""mistreated"" shows that you are being subjective, because other people literally do not see what they are doing as ""mistreating"". When you judge a murderer in a court of law, you are only being objective within the constraints of the law, and analysing a case as it relates to the laws in place. *The laws themselves are based on subjective ideologies.*Example: Let's say a guy gets arrested for having a lot of weed. It's illegal to possess marijuana, and you're a judge. You disagree with the law, but because you are a judge, you have to ""remain objective"" and sentence the guy based on the evidence that he has a giant bag of weed. Is the judge really being objective? Only in the context of ""obeying the law.""I tried to get at this in another comment, but are you saying that we are all ""bound"" to a universal law that falls in line with your concept of morality? That's the only possible way that everyone in the world could ""objectively"" say that female circumcision/outlawing homosexuality/etc are ""wrong"". We would need to be constrained by a set of undeniable principles to adhere to. And I would argue that no such thing actually exists."
,reddit.com/r/changemyview,"I just think that at the end of the day, AnCap would work better, AND you don't have to impose your own opinions on others (see: gay marriage, gun rights, marijuana legalization, medical regulations, restrictions on food products such as raw milk, speed limits, the war on drugs, the war on terror, the war on poverty, the war on obesity, etc... for examples on how government extends its reach beyond protection of the people and enforcement of the will of the majority)",Krono5_8666V8,00-6-2014,,"We can take all the time in the world to adress possible scenarios where a society without a government could open people up to potential for harm due to the lack of a government. The government allows alcohol to be legal, and people die from it daily. you could say the same about bleach, but the answer is not to put every aspect of humanity under federal supervision. To me, it's not worth sacrificing my freedom to do something so that another person can stop me from doing it.""They that can give up essential liberty to purchase a little temporary safety, deserve neither liberty nor safety. They that can give up essential liberty to obtain a little temporary safety deserve neither liberty nor safety. Those Who Sacrifice Liberty For Security Deserve Neither. He who would trade liberty for some temporary security, deserves neither liberty nor security. He who sacrifices freedom for security deserves neither. People willing to trade their freedom for temporary security deserve neither and will lose both. If we restrict liberty to attain security we will lose them both. Any society that would give up a little liberty to gain a little security will deserve neither and lose both. He who gives up freedom for safety deserves neither. Those who would trade in their freedom for their protection deserve neither. Those who give up their liberty for more security neither deserve liberty nor security.""That's a Ben Franklin quote with a bit of controversy around it. Regardless of how he meant it, I think it perfectly sums up my opinion on government when it comes to the ways in which we attempt to ensure the best possible life for ourselves. I understand completely that you, like myself, are only concerned with doing what you think is best for everyone, and I respect that. I just think that at the end of the day, AnCap would work better, AND you don't have to impose your own opinions on others (see: gay marriage, gun rights, marijuana legalization, medical regulations, restrictions on food products such as raw milk, speed limits, the war on drugs, the war on terror, the war on poverty, the war on obesity, etc... for examples on how government extends its reach beyond protection of the people and enforcement of the will of the majority)"