url,domain,title,authors,publish_date,summary,text
,reddit.com/r/science,"For God fucking sake, people, they're based in a region of the world where an ounce of Marijuana or a picture of Muhammed will get you a State-sanctioned death sentence. SLOETJES!!! Do you really need people to cite sources on common knowledge? If you're not aware that the Arab world is still living in the stone age when it comes to press freedom, then you're ignorance, like most people's ignorance on this website, is astounding.",average-guy,00-7-2008,,"You're serious? So, you're saying that a news station which serves a population that does not allow press freedom is less biased than a news station in a country which does allow press freedom? You, and so many people Reddit, cling onto views which are unbelievably dumb. Are you honestly trying to say that Heartrush is wrong? Are you honestly saying that Al Jazeera does not have a pro-Arab bias? For God fucking sake, people, they're based in a region of the world where an ounce of Marijuana or a picture of Muhammed will get you a State-sanctioned death sentence. SLOETJES!!! Do you really need people to cite sources on common knowledge? If you're not aware that the Arab world is still living in the stone age when it comes to press freedom, then you're ignorance, like most people's ignorance on this website, is astounding. Granted, Al Jazeera is doing great things to liberalize the problems of press freedom in the Middle East - but it's a long ways off. I mean, do you want someone to cite you statistics on press freedom in the Arab world? That should be enough to PROVE that an Arab news station is limited in what it can say."
,reddit.com/r/WTF,"Cal Supreme Court Rules Prop 215 Caregivers Must Do More Than Just Supply Marijuana In a blow to medical marijuana providers, the California Supreme Court ruled that defendants are not entitled to a defense as Prop 215 caregivers if their primary role is only to supply marijuana to patients.",wellhell,00-11-2008,,"Cal Supreme Court Rules Prop 215 Caregivers Must Do More Than Just Supply Marijuana In a blow to medical marijuana providers, the California Supreme Court ruled that defendants are not entitled to a defense as Prop 215 caregivers if their primary role is only to supply marijuana to patients. The court unanimously overruled an appellate court decision in the case People v Roger Mentch"", writing: "" We hold that a defendant whose caregiving consisted principally of supplying marijuana and instructing on its use, and who otherwise only sporadically took some patients to medical appointments, cannot qualify as a primary caregiver under the Act and was not entitled to an instruction on the primary caregiver affirmative defense. We further conclude that nothing in the Legislature's subsequent 2003 Medical Marijuana Program (Health & Saf. Code,  11362.7 et seq.) alters this conclusion or offers any additional defense on this record. "" Full text of the decision may be found at  Prop 215 defines primary caregiver to be the ""individual designated by the [patient]... who has consistently assumed responsibility for the housing, health, or safety of that person."" According to the Court, these words "" imply a caretaking relationship directed at the core survival needs of a seriously ill patient, not just one single pharmaceutical need. "" The Court concluded, "" a defendant asserting primary caregiver status must prove at a minimum that he or she (1) consistently provided caregiving, (2) independent of any assistance in taking medical marijuana, (3) at or before the time he or she assumed responsibility for assisting with medical marijuana. "" The Court's ruling effectively limits the caregiver defense to relatives, personal friends and attendants, nurses, etc. In particular, it excludes its use by medical marijuana ""buyers' clubs,"" retail dispensaries and delivery services. The remaining legal defense for medical marijuana providers is to organize as patient cooperatives and collectives, which are legal under SB 420."
,reddit.com/r/news,"Marijuana is harmless compared to the scourge of crystal meth in Northern California. How about respecting California's Prop 215, and going after the methamphetamine labs instead? It's been reported there are as many as 50 meth labs near the mouth of the Klamath River, yet law enforcement never takes any action there: to the Del Norte Sheriff's Department, the Humboldt County Sheriff's Department and Larry Hand of the California Conservation Corps (CCC), a CCC crew run by John Buttons discovered several large glass flasks used for cooking methamphetamine on Ohpah Creek, a tributary of the Klamath River just 21 miles from the mouth of the river.",BREAKING_OMG,00-6-2008,,"Marijuana is harmless compared to the scourge of crystal meth in Northern California. How about respecting California's Prop 215, and going after the methamphetamine labs instead? It's been reported there are as many as 50 meth labs near the mouth of the Klamath River, yet law enforcement never takes any action there: to the Del Norte Sheriff's Department, the Humboldt County Sheriff's Department and Larry Hand of the California Conservation Corps (CCC), a CCC crew run by John Buttons discovered several large glass flasks used for cooking methamphetamine on Ohpah Creek, a tributary of the Klamath River just 21 miles from the mouth of the river. The flasks were found in the summer of 2002 and were left on Simpson Timber Company land above the Ohpah Creek Ranch. It now turns out the flasks were part of what is known as a ""meth dump."" That is where the unused residue and cooking utensils from labs are discarded. A Humboldt County Sheriff's Department official used a recent dumpsite at Colusa, to explain, ""Mexican nationals had dumped their old chemicals and supplies into an irrigation canal."" Two persons interviewed claimed there are five meth labs between Weitchpec and the river mouth. One of the labs is known to both civilian and law enforcement as the ""Crystal Palace."" When asked, one Siskiyou County law enforcement official said, ""If the truth were know, there are probably 50 labs."" ... The entire 41 miles of river between Weitchpec and the river mouth has no roads and is completely isolated from any civilization. There are dozens of documented cases of Mexican and Asian drug cartels using remote areas to both grow marijuana, and manufacture meth. These cases include the Klamath River area. This has resulted in concerns for the safety of all users; either national forests and/or Bureau of Land Management lands or those who simply explore for recreation."
,reddit.com/r/politics,"Marijuana and hemp would have never been criminalized and we wouldn't have half the problems we have today. Some of those problems include deforestation, the death of American farms, the pollution of our rivers and lands with the chemicals necessary to break down the fiber in wood into pulp, the high costs (environmental, military and economic) of oil based goods such as plastic and nylon thread clothing, the high cost of the production of soy bean based ethanol and the costs associated with housing an inmate population of non violent offenders.",sublimeone,00-12-2009,,"If it was not for William Randolf Hurst and DuPont pumping millions of their dollars, to save their own outdated investments, into criminalization of a plant which would have revolutionized how goods were made. Marijuana and hemp would have never been criminalized and we wouldn't have half the problems we have today. Some of those problems include deforestation, the death of American farms, the pollution of our rivers and lands with the chemicals necessary to break down the fiber in wood into pulp, the high costs (environmental, military and economic) of oil based goods such as plastic and nylon thread clothing, the high cost of the production of soy bean based ethanol and the costs associated with housing an inmate population of non violent offenders. The same tactics of fear, hate and racism the Bush administration and so far the current administration have used to strip the average citizen of most every right we once possessed were used to strip us of our right to a better alternative source of medicine, relaxation, bio-fuel, paper, plastic and numerous other products that's invention may never occur or has been delayed. Not due to any real threat from Marijuana concerning the public health. But, due to one of the most egregious violations of the public trust ever committed by the federal government and the real people in power here in America, The wealthiest of the wealthy business owners."
,reddit.com/r/reddit.com,Pro-marijuana>I don't smoke weed and never have. But it pisses me off to see otherwise normal people prosecuted to the full extent of the law for smoking a god damn plant. It pisses me off to see our tax dollars wasted to pay for a failing drug war and lock people up for years.,Tekmo,00-5-2009,,"Ok, I'm sorry, but the OP is part of the problem that he condemns. Just a casual browse through his comments shows that he buys into several typical reddit hivemind positions:Anti-religion:>Wow, isn't this the same place where they indoctrinate you to pledge allegiance ""under God""? Pro-marijuana>I don't smoke weed and never have. But it pisses me off to see otherwise normal people prosecuted to the full extent of the law for smoking a god damn plant. It pisses me off to see our tax dollars wasted to pay for a failing drug war and lock people up for years. It pisses me off to see our homes broken into, dogs shot, and families terrorized because some dipshit cop can't read an address correctly. It pisses me off that our rights are being taken away in the name of buzz-killing. It's insane and idiotic. So fuck you. Anti-war on drugs:> Nah, our Government would rather keep the war on drugs so it can hand our taxpayer dollars over to the prison-industrial complex, and then hope the South/Central American cartels get powerful enough that we have to get involved militarily. Then they can give the rest of our taxpayer dollars to the military-industrial complex and really crack down on our freedoms at home. Militarized cartels blowing shit up in southern California is our government's wet dream. Meme:>I accidentally the whole pun. Anti-cop:>I try to tell people, but they're too fucking stupid to accept it: cops are unconstitutional and we'd be better off without them. Of course, the original poster decided he would improve the quality of reddit by submitting high quality articles which challenged our worldview. Oh wait, he didn't. I'll let you see what he actually submitted. The point I'm trying to make is that everybody is a part of the problem you decry even if you don't think you are. When we down-vote stuff that we think is stupid or unreasoned we think we are being judicious and reasonable, but when everybody else does it they are just following the hivemind. Maybe you guys should realize that every other poster on reddit is EXACTLY like you and is capable of thinking for themselves and when they downvote your shit, it's not because they are following the crowd but because they actually came to that conclusion on their own just like you do when you downvote their shit."
,reddit.com/r/Marijuana,"This man is going out and getting candidates *on film* stating their opinions specifically on the issue of medical marijuana, for everyone to see. That is incredibly helpful on one front to the case for legalization for medicinal purposes. Any medical marijuana activist can tell you that most conservatives love to sideline the debate on medical marijuana... bringing up the availability of drugs like marinol, the larger ""slippery slope"" argument of what federal medical marijuana legalization will do (""Uh... we'll then have to legalize marijuana for everybody!",dbchappell1,00-9-2009,,"> This cripplekid- wheelchair jockey, muscular dystrophy patient, whatever you want to call himFirst off, this is a *man* who has gone his entire life never being able to develop substantial muscle mass, and unless science intervenes, he is going to have to spend the rest of his days with his body consuming itself until he dies a painful death. He's a man, a human being, and that's how you should think of him.> is at best completely indifferent to and at worst detrimental to the cause of legalization. You're making a pretty large conclusion based on a little bit of information. This man is going out and getting candidates *on film* stating their opinions specifically on the issue of medical marijuana, for everyone to see. That is incredibly helpful on one front to the case for legalization for medicinal purposes. Any medical marijuana activist can tell you that most conservatives love to sideline the debate on medical marijuana... bringing up the availability of drugs like marinol, the larger ""slippery slope"" argument of what federal medical marijuana legalization will do (""Uh... we'll then have to legalize marijuana for everybody! Then we'll have to legalize all drugs! Then all of our children will become raging dope addicts!"" etc) so in order to cut short that argument before it can even start, I wouldn't be surprised if this man was only saying that to keep the conversation focus on the issue of medicinal legalization in the very short space of time that he had. And given the ambiguity of his statement, who is to say he doesn't feel it should be illegal for children but not consented adults? Have you spoken with him directly?> I certainly would rather see people like him (although not him in particular) be able to use whatever medication they need to relieve their symptoms before I'd like to see legalization. Somebody *may* not agree exactly with you on *part* of marijuana policy, so you think it's okay for them to spend the rest of their life in agonizing pain? Does it not strike you that that sentiment is just as extremist and thoughtless as some of the opinions held by anti-drug activists? You don't know this guy, nor what he's been through, and you do a disservice to everyone in the legalization movement by resorting to disrespectful name-calling of a hurting individual that you disagree with."
,reddit.com/r/politics,"With California and possibly a few other states bringing the legalization of marijuana up for consideration this year, I think we stand to see states' rights become a more accepted position among progressives. It will have to be, considering what will happen will basically be legislative revolt.",evilrobonixon2012,00-1-2010,,"I'm becoming more and more of the opinion that we need to start shifting back to states' rights. I say this as someone who is on the far left when it comes to economic and social issues, and it still feels kind of weird on its way out. The way I've started looking at it is this though, making certain issues into national talking points when they don't have to be keeps things practically at a stalemate. I'm willing to let folks here in my home state of Alabama run shit a little bit more backwards around here if it means that true reform can happen in other states and act as a tangible good example. As it stands, truly reformist ideas can't get any sort of foothold. With California and possibly a few other states bringing the legalization of marijuana up for consideration this year, I think we stand to see states' rights become a more accepted position among progressives. It will have to be, considering what will happen will basically be legislative revolt. Beyond returning more sovereignty to the states, I also think the people on the far left and the far right have another common interest. Proportional representation in each state and at the the federal level. I see the Tea Partiers as the American equivalent of the BNP. I don't like their ideology one bit, but I think both of our camps could make more gains if that sort of reform was made. You would, I think, see a broad enough spectrum of moderates take seats to keep things balanced though."
,reddit.com/r/politics,"Namely, I hold him directly responsible for failing to repeal the abuses of the Bush administration: -Warrantless wiretapping-The assassination of US citizens-The failure to close Guantanamo -A ramping up in Afghanistan with a completely dishonest promise to draw down in a year.-The failure to pull out of Iraq - still tens of thousands of troops, while we've dramatically increased the number of mercenaries we have there.-Continued prosecution of the drug wars, especially in states that vote for medical or legalized marijuana.-The persecution of wikileaks, anti-war groups, and generally expanding the definition of 'terrorist' into anyone the government doesn't like.-Don't Ask Don't Tell - this is set by Congress, but it is the Executive Branch that has decided to continue to appeal it.",tjl2015,00-10-2010,,"I'm a 23-year old voter, and I don't hold Obama responsible for a lot of the failures in Congress. The stimulus bill could have been better (larger, more infrastructure-focused), but the health care bill was probably the best we were going to get out of this Congress. Overall, his legislative record has been decent given the hand he was dealt. Were I do damn him, however, is the area the president has direct control over. Obama has no one to blame but himself for a lot of these failures; Congressional Republicans are not even involved. Namely, I hold him directly responsible for failing to repeal the abuses of the Bush administration: -Warrantless wiretapping-The assassination of US citizens-The failure to close Guantanamo -A ramping up in Afghanistan with a completely dishonest promise to draw down in a year.-The failure to pull out of Iraq - still tens of thousands of troops, while we've dramatically increased the number of mercenaries we have there.-Continued prosecution of the drug wars, especially in states that vote for medical or legalized marijuana.-The persecution of wikileaks, anti-war groups, and generally expanding the definition of 'terrorist' into anyone the government doesn't like.-Don't Ask Don't Tell - this is set by Congress, but it is the Executive Branch that has decided to continue to appeal it. And so on. There's a lot the president can't do, but you can't just throw up your hands and blame it all on the other party. These are things he could have fixed the first day in office, but decided not to for various reasons."
,reddit.com/r/cannabis,"* If no pot is found, just plant some from your personal stash. * Make sure to make lots of noise and use sirens and flashing lights throughout the raid, so that all the neighbors see what's happening. * Once the raid is finished, return to the precinct, where we all strip down and have sex with each other, rolling around in the sweet testosterone.",[deleted],00-5-2010,,"Police tactics 101: * Using threats and intimidation, obtain information on who has a dime bag. * Make sure the evil drugsmoker has children and small, harmless dogs. Actual drug dealers will not do, they may have guns, and we can't risk that. * Assemble a SWAT team in full riot gear. Bring large automatic guns, tear gas, tasers, lasers, attack dogs, a helicopter. * Before the raid, get each other pumped up in a ""safety"" meeting, make sure all involved know that that maximum violence is mandatory. * Arrive at house quickly. Without knocking, or announcing presence in any way, kick down door, and rush in, guns blazing. * Yell ""It's coming right for me!!"" and immediately shoot chihuahua. Then Jack Russel terrier. Each gunner is required to put three full clips into each animal. Clips will be checked after raid, and any officer with too many bullets remaining will be reprimanded. * I must stress again that the *dogs must die.* This is the most important element in any raid. There once was a raid in which one of the small dogs lived, and the officers involved were never the same. Their wives left them for black men, because they could no longer sustain erections. Don't let this happen to you. * Rip screaming children from mother, throwing mother to the ground and cuffing her while they watch. * Remember to take the time to talk down and deride the criminals. It is your duty as an officer of the law to punish them as much as you can. * If no pot is found, just plant some from your personal stash. * Make sure to make lots of noise and use sirens and flashing lights throughout the raid, so that all the neighbors see what's happening. * Once the raid is finished, return to the precinct, where we all strip down and have sex with each other, rolling around in the sweet testosterone. * Release a statement to the press, saying any accusations of wrongdoing are totally false, and that we will conduct an internal investigation. The investigation, of course, will determine that all officers involved acted within the law, and should be awarded for their heroism and bravery."
,reddit.com/r/trees,"I guess I'm just dumb, but I smoke weed while driving all the time. I feel like I have a pretty good routine though that minimizes my chances of getting caught. I keep my dugout in a glass jar in my center console. There is literally no smell until I open it up.",MadDogTannen,00-4-2011,,"I guess I'm just dumb, but I smoke weed while driving all the time. I feel like I have a pretty good routine though that minimizes my chances of getting caught. I keep my dugout in a glass jar in my center console. There is literally no smell until I open it up. I open my sunroof, pack my one-hitter (which looks like a cig), light, roll down the windows and chill like I'm smoking a cig. I repeat this until I'm high enough, and then I'll throw it all back in the jar, throw the jar in my center console, run all my vents on high with the windows down to blow out the smell, chew some gum, and keep on driving. I never speed, I never light or exhale while stopped, and I only do it on roads I know really well. As far as risk goes, I'm certainly vulnerable to a search since I keep it in my unlocked center console. But it's very stealthy visually since the one-hitter looks like a cig. I could see getting caught if a cop saw the smoke blowing out of my car and smelled that it was pot. I could also see getting caught loading it if a cop thought I was dicking around with my phone and was looking for a texting while driving bust, which is why I usually don't look down while I'm loading it. Even though I think my system is pretty good, it's probably more risk than I should be taking on considering the consequences, but since the wife got all judgmental about my pot use, I find it more beneficial to do the majority of my smoking where she won't see it."
,reddit.com/r/AskReddit,"What are the FDA regulations on marijuana? Where will it be grown, regionally? Import, export, relations with with countries that don't support legalization. Relations with countries that do. Relations with countries whose economic models are in part based off illegal drug trade, how will it affect them.",SpanningInfatuation,00-1-2011,,"This isn't ""my buddies."" Like so many others in my region, this isn't about our friends and their three plants in their closet. It's about our families. Our friend's families. I already said I support legalization. Just don't try to make it a black and white issue. That being said, notice that your little joke about their new income is something else that would be a crime. You have one blanket statement over an issue that is profoundly complex and intricate. What are the FDA regulations on marijuana? Where will it be grown, regionally? Import, export, relations with with countries that don't support legalization. Relations with countries that do. Relations with countries whose economic models are in part based off illegal drug trade, how will it affect them. What kind of price index are we talking, because that's entirely regional at the moment. I want to see it legalized. I don't want it in the hands of the corporations. What needs to be changed is the overall perception of drugs in this country, and you can't legislate that anyway. Many many people's livelihood is based on it. Many good people, completely separate from mainstream drug trade, rely on it, because if they didn't absolutely have to do it, they wouldn't. It's dangerous, they risk themselves and the wealth of their families on it. They wouldn't do that if they had another choice. Thanks for your narrow view of something so conceptually open to interpretation, and your assumption that this market is only open for the middle class that want to make a little extra money on the side."
